Product Name,Author,Price,Ratings
Geracao Som [Disco de Vinil],Pepeu Gomes,"R$240,28",-1
Cesar Camargo Mariano [Disco de Vinil],Cesar Camargo Mariano,"R$170,89","5,0 de 5 estrelas"
Dirty Dancing O.S.T.,Various,"R$149,72","4,7 de 5 estrelas"
"Cachorro Grande, Lp Cinema [Disco de Vinil]",Cachorro Grande,"R$95,00",-1
Reservoir Dogs (Original Motion Picture Soundtrack) [Disco de Vinil],Soundtrack,"R$157,25","4,1 de 5 estrelas"
The Book of Mormon (Original Broadway Cast Recording) [Disco de Vinil],Various Artists,"R$384,00","4,8 de 5 estrelas"
LP Nervo Chaos/Amazarak - Ascemsão Do Caos [Disco de Vinil],Nervo Chaos,"R$67,00",-1
Correntes [Disco de Vinil],Metalmorphose,"R$37,00",-1
The Greatest Showman [Disco de Vinil],The Greatest Showman (Original Motion Picture Soundtrack),"R$176,53","4,8 de 5 estrelas"
Jack Johnson (Original Soundtrack) [Disco de Vinil],"DAVIS,MILES","R$543,87","4,5 de 5 estrelas"
"Os Paralamas Do Sucesso, LP Sinais Do Sim [Disco de Vinil]",Os Paralamas do Sucesso,"R$95,00",-1
"Café Preto e Céu, Compacto Água, Fogo, Terramar [Disco de Vinil]",Café Preto + Céu,"R$40,00",-1
"Marcos Valle, LP Vento Sul- Série Clássicos Em Vinil [Disco de Vinil]",Marcos Valle,"R$110,00","4,2 de 5 estrelas"
Cleopatra Jones (Original Soundtrack From the Motion Picture),VARIOUS ARTISTS,"R$192,00",-1
Game of Thrones: Season 4 (Music From the HBO Series) [Disco de Vinil],GAME OF THRONES: SEASON 4 (2LP/LIMITED TOUR EDITION TRANSPARENT/180G/GATEFOLD),"R$272,00","4,5 de 5 estrelas"
Game Of Thrones: Season 5 (Original Soundtrack) [Disco de Vinil],GAME OF THRONES: SEASON 5 (2LP/LIMITED TOUR EDITION TRANSPARENT BLUE/180G/GATEFOLD),"R$374,30","4,6 de 5 estrelas"
V for Vendetta (Original Motion Picture Soundtrack) [Disco de Vinil],Various Artists,"R$275,37","4,6 de 5 estrelas"
Manhunter (Music From the Motion Picture) [Disco de Vinil],Manhunter (Original Soundtrack),"R$394,71","5,0 de 5 estrelas"
Annihilation (Original Motion Picture Soundtrack),Ben Salisbury & Geoff Barrow,"R$239,34","4,5 de 5 estrelas"
Runaways (Original Soundtrack) [Disco de Vinil],Various Artists,"R$194,17",-1
Rick and Morty (Original Soundtrack) [Disco de Vinil],Rick & Morty,"R$222,53","4,8 de 5 estrelas"
Rick and Morty (Original Soundtrack) [Disco de Vinil],Rick & Morty,"R$661,75","4,3 de 5 estrelas"
Tenebrae (Original Soundtrack) [Disco de Vinil],unknown-author,"R$403,59",-1
Big Trouble in Little China (Original Motion Picture Soundtrack) [Disco de Vinil],KONAMI KUKEIHA CLUB,"R$466,36","4,1 de 5 estrelas"
Harry Potter And The Goblet Of Fire [Disco de Vinil],Patrick Doyle,"R$792,93","4,3 de 5 estrelas"
Mean Girls,Mean Girls (Original Broadway Cast Recording),"R$223,42","4,7 de 5 estrelas"
Harry Potter And The Prisoner Of [Disco de Vinil],John Williams,"R$792,93","4,8 de 5 estrelas"
Go: Music From The Motion Picture (Limited Gopaque Yellow Vinyl),Various Artists,"R$270,94",-1
Gone With the Wind (Original Motion Picture Soundtrack) [Disco de Vinil],"STEINER,MAX","R$139,71","4,0 de 5 estrelas"
